{
  "$schema": "./automation-projections-lock.v1.schema.json",
  "schemaVersion": 1,
  "status": "draft",
  "canonicalRepository": "agentic-delivery-lab/agentic-delivery",
  "sourceCommit": "98495275481aff381180771da6eba9da95bc7816",
  "projectionRepository": "agentic-delivery-lab/agentic-delivery-distribution",
  "projectionRelease": "urn:agentic-delivery:distribution:0.1.0-draft.26",
  "templates": [
    {
      "id": "review-delivery-queue",
      "sourcePath": "automations/templates/review-delivery-queue.automation.md",
      "targetPath": "packages/agent-plugin/automations/review-delivery-queue.automation.md",
      "sourceRef": "98495275481aff381180771da6eba9da95bc7816",
      "contentSha256": "a12acbc9851e58e5b578176f04ab5c2a1b53576587893434c4d05b1f022a981b",
      "compatibilityTargets": [
        "vscode-automations",
        "agent-plugin"
      ]
    },
    {
      "id": "prepare-validation-evidence",
      "sourcePath": "automations/templates/prepare-validation-evidence.automation.md",
      "targetPath": "packages/agent-plugin/automations/prepare-validation-evidence.automation.md",
      "sourceRef": "98495275481aff381180771da6eba9da95bc7816",
      "contentSha256": "07452663c6df7b1e98a2184741ccaa8e919f6994a2a19b64e2ef3cba3144ff5a",
      "compatibilityTargets": [
        "vscode-automations",
        "agent-plugin"
      ]
    }
  ]
}
